step_number,description,Recipe_name
19,Transfer to plates and let cool 10 minutes,Gorditas con Camarones
20,"Insert a paring knife into side of gordita and, using a slow sawing motion, cut open along one side (keep other side intact).
Heat remaining 2 Tbsp",Gorditas con Camarones
21,lard in a large skillet over high,Gorditas con Camarones
22,"Cook shrimp until lightly browned and just cooked through, about 1 minute per side",Gorditas con Camarones
23,Transfer to a medium bowl,Gorditas con Camarones
24,"Reduce heat to medium and cook garlic in same skillet, tossing often, until beginning to brown, about 1 minute",Gorditas con Camarones
25,"Add thyme sprigs, vinegar, agave, 1½ tsp",Gorditas con Camarones
26,Diamond Crystal or 1 tsp,Gorditas con Camarones
27,"Morton kosher salt, and reserved chile purée",Gorditas con Camarones
28,"Cook, stirring occasionally, until brick red and the consistency of a thick sauce, 6–8 minutes",Gorditas con Camarones
29,Add shrimp and any juices and cook 1 minute,Gorditas con Camarones
30,Remove from heat; add butter and stir constantly until melted and sauce is glossy,Gorditas con Camarones
31,Season with more salt if needed,Gorditas con Camarones
32,"Remove and discard thyme.
Fill gorditas with shrimp mixture, onion, avocado, and cilantro",Gorditas con Camarones
33,Serve with lime wedges for squeezing over.,Gorditas con Camarones
1,Using 2 Tbsp,Enfrijoladas
2,"oil, brush both sides of each tortilla",Enfrijoladas
3,Heat a large skillet over medium-high,Enfrijoladas
4,"Working in batches, cook until lightly browned and starting to crisp, about 1 minute per side",Enfrijoladas
5,"Set aside.
Heat remaining 3 Tbsp",Enfrijoladas
6,oil in same skillet over medium-high,Enfrijoladas
7,"Cook chorizo, breaking up with a wooden spoon, until browned and cooked through, 7–9 minutes",Enfrijoladas
8,"Using a slotted spoon, transfer to a medium bowl; set aside.
Add garlic and ½ onion to same skillet, season with salt, and cook, tossing occasionally, until tender and beginning to brown, 6–8 minutes",Enfrijoladas
9,"Using slotted spoon, transfer garlic mixture to a blender; reserve pan with oil",Enfrijoladas
10,"Add beans and broth to blender and purée until smooth (it should be the consistency of yogurt); season with salt.
Set reserved pan over medium-high and heat oil",Enfrijoladas
11,Transfer bean purée to skillet and bring to a boil,Enfrijoladas
12,Reduce heat to low,Enfrijoladas
13,"Working one at a time and using tongs, dip tortillas in bean purée, turning to coat and leaving until softened, about 3 seconds per side (they will soften more as they sit)",Enfrijoladas
14,Transfer to a baking sheet as you go,Enfrijoladas
15,Spoon 1 Tbsp,Enfrijoladas
16,chorizo and 1 Tbsp,Enfrijoladas
17,"queso fresco across the center of each tortilla; fold over like a taco.
Divide among plates and spoon remaining bean purée over",Enfrijoladas
18,"Top with cilantro, avocado, more onion, remaining chorizo, and remaining queso.",Enfrijoladas
1,Heat oil in a large nonstick skillet over medium-high,Caramelized Plantain Parfait
2,"Cook plantains, turning once, until deep golden brown, about 3 minutes per side",Caramelized Plantain Parfait
3,"Transfer to paper towels to drain; season with salt.
Divide yogurt among bowls; top with plantains and mangoes, then nuts, seeds, and/or coconut as desired.",Caramelized Plantain Parfait
1,Season chicken all over with 4 tsp,Chicken and Potato Gratin With Brown Butter Cream
2,salt,Chicken and Potato Gratin With Brown Butter Cream
3,Place in an airtight container and cover,Chicken and Potato Gratin With Brown Butter Cream
4,"Chill at least 1 hour and up to 1 day.
Place a rack in middle of oven; preheat to 425°F",Chicken and Potato Gratin With Brown Butter Cream
5,"Toss potatoes, shallots, and 2 tsp",Chicken and Potato Gratin With Brown Butter Cream
6,"salt in a large bowl.
Melt 4 Tbsp",Chicken and Potato Gratin With Brown Butter Cream
7,"butter in a small saucepan over medium heat and cook, stirring often, until butter foams, then browns, 5–8 minutes",Chicken and Potato Gratin With Brown Butter Cream
8,"Immediately remove from heat (it will continue to darken) and stir in cream, garlic, pepper, nutmeg, and remaining 1½ tsp",Chicken and Potato Gratin With Brown Butter Cream
9,salt,Chicken and Potato Gratin With Brown Butter Cream
10,"Set saucepan over medium-low heat and cook, stirring, until salt is dissolved and mixture is warm to the touch",Chicken and Potato Gratin With Brown Butter Cream
11,"Stir in thyme and sage; remove from heat.
Heat remaining 1 Tbsp",Chicken and Potato Gratin With Brown Butter Cream
12,butter in a large stainless-steel skillet over medium-high until melted and bubbling,Chicken and Potato Gratin With Brown Butter Cream
13,"Working in 2 batches, cook chicken, skin side down, until golden underneath, about 5 minutes",Chicken and Potato Gratin With Brown Butter Cream
14,"Transfer chicken to a 13x9"" or 3-qt",Chicken and Potato Gratin With Brown Butter Cream
15,baking dish and arrange skin side up,Chicken and Potato Gratin With Brown Butter Cream
16,Set skillet with pan drippings aside,Chicken and Potato Gratin With Brown Butter Cream
17,Nestle potatoes and shallots around chicken (don’t place on top),Chicken and Potato Gratin With Brown Butter Cream
18,"Pour brown butter cream over chicken and vegetables, making sure herbs and spices are evenly dispersed and tucking herbs into vegetables so they don’t get too crispy when they bake.
Bake gratin until cream is mostly reduced and chicken and vegetables are dark golden brown, about 40 minutes",Chicken and Potato Gratin With Brown Butter Cream
19,"Let gratin cool 5–10 minutes.
Meanwhile, pulse bread in a food processor until pieces are about oat-size (you should have about 1¼ cups)",Chicken and Potato Gratin With Brown Butter Cream
20,Toss breadcrumbs in pan drippings in reserved skillet to coat,Chicken and Potato Gratin With Brown Butter Cream
21,"Cook over medium heat, scraping up browned bits with a spatula, until deep golden brown, 5–7 minutes",Chicken and Potato Gratin With Brown Butter Cream
22,"Let cool.
To serve, top gratin with breadcrumbs",Chicken and Potato Gratin With Brown Butter Cream
23,Serve lemon wedges alongside for squeezing over if desired.,Chicken and Potato Gratin With Brown Butter Cream
1,Place the zest strips in a small saucepan and cover with water,Roasted Beets With Crispy Sunchokes and Pickled Orange-Ginger Purée
2,"Bring the water to a boil, then drain",Roasted Beets With Crispy Sunchokes and Pickled Orange-Ginger Purée
3,Repeat this process two more times (blanching the orange zest removes any bitter flavors),Roasted Beets With Crispy Sunchokes and Pickled Orange-Ginger Purée
4,Place the ginger and orange zest in a jar or heatproof container,Roasted Beets With Crispy Sunchokes and Pickled Orange-Ginger Purée
5,"In a saucepan, bring the lime juice, vinegar, sugar, and ¾ teaspoon salt to a boil",Roasted Beets With Crispy Sunchokes and Pickled Orange-Ginger Purée
6,Pour over the ginger and orange,Roasted Beets With Crispy Sunchokes and Pickled Orange-Ginger Purée
7,"Let cool to room temperature, then cover and refrigerate overnight",Roasted Beets With Crispy Sunchokes and Pickled Orange-Ginger Purée
8,"The pickled ginger can be refrigerated for a couple of months.
Drain the pickled ginger and orange and save 3 tablespoons of the pickling liquid",Roasted Beets With Crispy Sunchokes and Pickled Orange-Ginger Purée
9,"Add both to a blender or mini food processor, along with the olive oil, chile, and remaining 2 tablespoons salt",Roasted Beets With Crispy Sunchokes and Pickled Orange-Ginger Purée
10,"Blend until very smooth, scraping down the side of the blender as needed",Roasted Beets With Crispy Sunchokes and Pickled Orange-Ginger Purée
11,Transfer to a container and refrigerate until ready to use,Roasted Beets With Crispy Sunchokes and Pickled Orange-Ginger Purée
12,The puree can be made a couple of days ahead,Roasted Beets With Crispy Sunchokes and Pickled Orange-Ginger Purée
13,"(Makes about 1 cup.)
Preheat the oven to 375°F",Roasted Beets With Crispy Sunchokes and Pickled Orange-Ginger Purée
14,"Place the beets in a baking dish (if using a mix of red and golden beets, separate them into two smaller dishes and divide the oil, vinegar, and water between the two dishes)",Roasted Beets With Crispy Sunchokes and Pickled Orange-Ginger Purée
15,Drizzle with the oil and add the water and vinegar,Roasted Beets With Crispy Sunchokes and Pickled Orange-Ginger Purée
16,Season with salt and pepper,Roasted Beets With Crispy Sunchokes and Pickled Orange-Ginger Purée
17,"Cover the pan with foil and roast until the beets are tender when pierced with a knife; this can take anywhere from 30 minutes to an hour, depending on the thickness of the beets",Roasted Beets With Crispy Sunchokes and Pickled Orange-Ginger Purée
18,"Let the beets cool, then peel and cut into 1-inch wedges",Roasted Beets With Crispy Sunchokes and Pickled Orange-Ginger Purée
19,"Place each color of beet, along with any accumulated juices, into a small mixing bowl.
In a skillet, heat the oil over medium-low heat",Roasted Beets With Crispy Sunchokes and Pickled Orange-Ginger Purée
20,"Add the cashews and cook, stirring constantly, until golden brown",Roasted Beets With Crispy Sunchokes and Pickled Orange-Ginger Purée
21,"Transfer to a heat-proof bowl.
Pour 1 inch of oil into a small saucepan and add the sunchokes (there should be just enough oil to cover the sunchokes; add more oil if needed)",Roasted Beets With Crispy Sunchokes and Pickled Orange-Ginger Purée
22,"Turn the heat to medium and stir occasionally; when the sunchokes begin to sizzle and foam, increase the temperature to high and continue frying, stirring constantly, until the sunchokes are light golden brown",Roasted Beets With Crispy Sunchokes and Pickled Orange-Ginger Purée
23,"At this point the sunchokes will rapidly go from golden brown to burnt, so quickly transfer the chips to paper towels to drain",Roasted Beets With Crispy Sunchokes and Pickled Orange-Ginger Purée
24,Lightly season with salt,Roasted Beets With Crispy Sunchokes and Pickled Orange-Ginger Purée
25,"The sunchoke chips can be stored in an airtight container at room temperature for a day or two, or until they start to soften",Roasted Beets With Crispy Sunchokes and Pickled Orange-Ginger Purée
26,"(Makes about ½ cup.)
Using a sharp knife, cut the peel and pith off the orange",Roasted Beets With Crispy Sunchokes and Pickled Orange-Ginger Purée
27,"Working over a bowl, cut the orange between the membranes to release the segments",Roasted Beets With Crispy Sunchokes and Pickled Orange-Ginger Purée
28,"Dice the segments, then return them to the bowl.
Drizzle the beet wedges with a little bit of olive oil, season with salt, and toss.
Spread the ginger puree on the bottom of a shallow serving bowl or plate",Roasted Beets With Crispy Sunchokes and Pickled Orange-Ginger Purée
29,Arrange the beets over the puree,Roasted Beets With Crispy Sunchokes and Pickled Orange-Ginger Purée
30,Sprinkle the chopped orange segments over the beets and grind some pepper over the dish,Roasted Beets With Crispy Sunchokes and Pickled Orange-Ginger Purée
31,"Top with the cashews, herbs, and sunchoke chips",Roasted Beets With Crispy Sunchokes and Pickled Orange-Ginger Purée
32,Serve.,Roasted Beets With Crispy Sunchokes and Pickled Orange-Ginger Purée
1,"Preheat oven to 220°C (425°F).
Place the pepitas into the bowl of a food processor and process until finely chopped",Kale and Pumpkin Falafels With Pickled Carrot Slaw
2,"Add the kale, garlic, chickpeas, turmeric, coriander, salt and pepper and process until well combined",Kale and Pumpkin Falafels With Pickled Carrot Slaw
3,Add the pumpkin and stir through to combine,Kale and Pumpkin Falafels With Pickled Carrot Slaw
4,Shape large tablespoonfuls of pumpkin mixture into balls,Kale and Pumpkin Falafels With Pickled Carrot Slaw
5,Place on a baking tray lined with non-stick baking paper and flatten slightly,Kale and Pumpkin Falafels With Pickled Carrot Slaw
6,"Brush well with oil, then bake for 25 minutes or until golden and crisp.
To make the pickled carrot slaw, place the carrots, vinegar, honey, chile and coriander in a bowl and toss to combine",Kale and Pumpkin Falafels With Pickled Carrot Slaw
7,"Set aside for 5 minutes to pickle.
To serve, divide the pickled carrot slaw between bowls and top with pumpkin falafels and serve with yoghurt and tahini.",Kale and Pumpkin Falafels With Pickled Carrot Slaw
1,"Preheat oven to 220°C (425°F).
Scoop the seeds from the squash and discard",Maple and Chile Roasted Squash With Quinoa Tabouli
2,"Place squash, cut side up, onto a baking tray",Maple and Chile Roasted Squash With Quinoa Tabouli
3,"Using the tip of a sharp knife, make some shallow slashes into the squash flesh",Maple and Chile Roasted Squash With Quinoa Tabouli
4,"Combine the oil, maple, chile, salt and pepper and brush over the squash",Maple and Chile Roasted Squash With Quinoa Tabouli
5,Cover with aluminium foil and roast for 20 minutes,Maple and Chile Roasted Squash With Quinoa Tabouli
6,"Remove the foil and roast for a further 40 minutes or until the squash is golden and soft.
To make the quinoa tabouli, in a large bowl combine the quinoa, mint, and arugula.
To make the lemon tahini dressing, in a small bowl, place the tahini, lemon juice, water, garlic and salt",Maple and Chile Roasted Squash With Quinoa Tabouli
7,"Mix to combine.
To serve, place the squash onto a serving platter and top with the tabouli",Maple and Chile Roasted Squash With Quinoa Tabouli
8,Drizzle with the lemon tahini dressing and sprinkle over almonds.,Maple and Chile Roasted Squash With Quinoa Tabouli
1,Preheat the oven to 350°F,Chhena Poda (Spiced Cheesecake)
2,"Butter a 9-inch nonstick metal cake pan with some ghee.
In a large bowl, stir together the paneer, confectioners’ sugar, and cardamom until incorporated but still slightly chunky",Chhena Poda (Spiced Cheesecake)
3,"Add the semolina, ghee, and milk and whisk until smooth",Chhena Poda (Spiced Cheesecake)
4,"Stir in the cashews and raisins and set aside.
Sprinkle the granulated sugar over the bottom of the prepared cake pan",Chhena Poda (Spiced Cheesecake)
5,"Set the pan on the stove over medium heat and once the sugar just begins to bubble and turn pale golden brown (the sugar will continue to caramelize in the oven, so don’t let it get any darker right now), after 8 to 10 minutes, remove the pan from the heat using tongs",Chhena Poda (Spiced Cheesecake)
6,"(This step is a bit tricky and you might be tempted to move the sugar around with a spoon while it is bubbling, but don’t touch it—just let it caramelize on its own.) You will know it’s ready for the cake batter when it’s bubbling but is still slightly grainy and just turning a pale golden color",Chhena Poda (Spiced Cheesecake)
7,"Pour the batter into the pan, using a rubber spatula to scrape the bowl clean",Chhena Poda (Spiced Cheesecake)
8,"It should settle into an even layer on its own, but if it doesn’t, use the spatula to create a smooth surface.
Wearing oven mitts, carefully transfer the pan to the oven and bake until a toothpick inserted into the center of the cake comes out clean, 40 to 45 minutes",Chhena Poda (Spiced Cheesecake)
9,Transfer to a wire rack and cool in the pan to room temperature,Chhena Poda (Spiced Cheesecake)
10,"Run a paring knife around the cake’s edges and then place a serving platter larger than the diameter of the cake over the cake and gently flip the cake over—it should slide out, with caramel coming out with it like you would see in a flan (though some caramel will be left in the pan—this is fine).
Slice and serve with freshly whipped cream or sliced almonds, if desired",Chhena Poda (Spiced Cheesecake)
11,"The cake will keep in a covered container in the refrigerator for up to 3 days.
Note: To clean the pan, add some boiling water to the pan and let it sit for at least 30 minutes to loosen up the browned sugar sticking to the surface of the pan before cleaning it.",Chhena Poda (Spiced Cheesecake)
1,"In a medium saucepan, heat the milk to 195°F over medium heat",Paneer
2,"Using a wooden spoon, stir frequently during the heating process to prevent the milk from scalding",Paneer
3,Be sure to scrape the bottom of the pan when you stir because this is where the milk is most prone to sticking,Paneer
4,"The milk will become foamy and bubbles will form on its surface once it reaches the desired temperature.
Remove from the heat and stir in the lemon juice until evenly distributed, which will cause the separation of curds from the whey",Paneer
5,"The process should begin right away, but don’t fret if it takes a minute or two",Paneer
6,Cover the pan and set aside at room temperature for 10 minutes to let the acid work its magic,Paneer
7,Check the mixture at this point: It should be slightly yellow and the curds should have completely separated from the whey,Paneer
8,Don’t panic if this hasn’t happened completely yet,Paneer
9,Simply add another teaspoon of acid and set aside for a few minutes more,Paneer
10,"This should do the trick.
Line a fine-mesh sieve with cheesecloth and set the sieve over a bowl",Paneer
11,Ladle the curds and whey into the sieve,Paneer
12,Reserve the whey for another use,Paneer
13,"Season the curds (still in the sieve) with salt, stirring it in using a wooden spoon, then gather up the edges of the cheesecloth into a tight bundle and squeeze the excess whey from the curds",Paneer
14,Place the cheesecloth and curds on a large plate and shape them into a square,Paneer
15,Wrap the cheesecloth edges around the paneer and place a second plate on top of it to compress it,Paneer
16,Set aside at room temperature for 30 minutes,Paneer
17,At this point the paneer is ready to use or it can be refrigerated in a covered container for up to 3 days.,Paneer
1,Preheat your oven to 400°F,Sloppy Joe Shirred Eggs With Spinach
2,"Combine the carrot, tomatoes plus their juice, and 1 cup water in a blender",Sloppy Joe Shirred Eggs With Spinach
3,"Blitz till it’s as smooth as your blender allows.
In an ovenproof 12-inch sauté pan or skillet set over medium heat, cook 1 tablespoon of the olive oil and the minced garlic",Sloppy Joe Shirred Eggs With Spinach
4,"Watch for the garlic to start sizzling, then stir in the spinach and ½ teaspoon of the salt",Sloppy Joe Shirred Eggs With Spinach
5,"Continue stirring for a minute, until all the spinach is wilted",Sloppy Joe Shirred Eggs With Spinach
6,"Remove it from the pan and set aside.
Add the final tablespoon olive oil to the pan, raise the heat to medium, and add the turkey plus 1 teaspoon salt",Sloppy Joe Shirred Eggs With Spinach
7,"Using a wooden spoon or spatula, break the turkey up into small morsels as it browns",Sloppy Joe Shirred Eggs With Spinach
8,"When you have browned turkey, add the cumin, paprika, and black pepper",Sloppy Joe Shirred Eggs With Spinach
9,"Stir to incorporate, toasting the spices for about 30 seconds.
Add the carrot-tomato mixture, the R-Rated Onions, vinegar, and ½ teaspoon salt",Sloppy Joe Shirred Eggs With Spinach
10,"Let this cook for about 15 minutes, uncovered, stirring occasionally",Sloppy Joe Shirred Eggs With Spinach
11,You may need to lower the heat to prevent Joe from sticking or splattering,Sloppy Joe Shirred Eggs With Spinach
12,When the ragout is done it will be thick and juicy,Sloppy Joe Shirred Eggs With Spinach
13,"If it seems too dry, stir in a little water",Sloppy Joe Shirred Eggs With Spinach
14,"Taste the ragout for seasoning and adjust as you like.
Turn the heat off and make four indentions in the ragout",Sloppy Joe Shirred Eggs With Spinach
15,Divide the spinach and put equal amounts in each indentation,Sloppy Joe Shirred Eggs With Spinach
16,Top each section of spinach with a cracked egg,Sloppy Joe Shirred Eggs With Spinach
17,"Sprinkle the eggs with the remaining 1 teaspoon salt.
Slide the skillet onto the middle rack of your preheated oven",Sloppy Joe Shirred Eggs With Spinach
18,"Bake for 10 to 12 minutes, until the whites are set and the yolks are slightly runny.
To serve, scatter ribbons of Parmigiano Reggiano or another hard cheese over the top",Sloppy Joe Shirred Eggs With Spinach
19,"If bread is your thing, this is great with toast.",Sloppy Joe Shirred Eggs With Spinach
1,"Peel your onions and cut them in half through their stem ends—longways, if you will",R-Rated Onions
2,"Slice them thinly with the grain, following the line from root to stem rather than cutting the onion across its belly",R-Rated Onions
3,"This is actually important because slicing it the other way makes the path to silky onions a longer one.
Once your onions are sliced, heat your skillet over medium-high heat and add the oil, then the onions and the salt",R-Rated Onions
4,Let the onions sizzle for a couple minutes,R-Rated Onions
5,Stir with a wooden spoon or a heatproof spatula and watch as they wilt for about 3 more minutes,R-Rated Onions
6,"At this point, reduce the heat to medium low",R-Rated Onions
7,Put a lid on and step away for a few minutes,R-Rated Onions
8,Give the onions a stir every now and then,R-Rated Onions
9,"You don’t have to stand over it like risotto, but don’t go for a walk around the block either",R-Rated Onions
10,"Caramelized bits will accumulate at the bottom and sides of the pan, and that’s good",R-Rated Onions
11,Just scrape them up and stir them in,R-Rated Onions
12,"A little color building as you go is okay, but don’t rush to brown them",R-Rated Onions
13,"The point is to cook the onions gently, coaxing them through stages of raw, wilted, sweaty, soft, light brown, and finally deeply caramelized
About 45 minutes in, remove the lid for the last time",R-Rated Onions
14,They should be a light caramel color,R-Rated Onions
15,"Now, with the lid off, you will need to watch more closely and stir more frequently",R-Rated Onions
16,"At some point you may find that despite your best efforts some of the caramelized bits, verging on burnt, cling to the pan and threaten over all onion ruin",R-Rated Onions
17,Do not fret! Just add a ½ cup or so of water and use its energy to help scrape up the stubborn but tasty film,R-Rated Onions
18,Let the water cook out of course,R-Rated Onions
19,"When you’re smiling over a soft, creamy, fragrant pile of mahogany onions, you’re done.
Note: R-Rated Onions will keep in the fridge for a week and in the freezer for 3 months.",R-Rated Onions
1,Preheat oven to 400°F,Miso-Squash Ramen
2,"Whisk oil, miso, maple syrup, and soy sauce in a small bowl until a thick paste forms",Miso-Squash Ramen
3,Place squash on a rimmed baking sheet and scrape dressing over; toss to coat,Miso-Squash Ramen
4,"Arrange squash in a single layer and roast until fork-tender (it will be a little caramelized in spots), 25–30 minutes.
Heat oil in a medium pot over medium-high",Miso-Squash Ramen
5,"Add ginger and garlic and cook, stirring, 1 minute",Miso-Squash Ramen
6,Add broth and bring to a boil,Miso-Squash Ramen
7,"Remove from heat.
Set 8 roasted squash wedges (or about 2 cups if using butternut) aside for serving",Miso-Squash Ramen
8,Add miso and remaining squash to pot and blend with an immersion blender until mostly smooth; season with salt and pepper,Miso-Squash Ramen
9,"(Alternatively, you can let broth cool slightly, then purée with sqush and miso in a regular blender.)
Meanwhile, bring a large pot of salted water to the boil and cook broccolini until crisp-tender, about 3 minutes",Miso-Squash Ramen
10,"Using tongs, transfer to a plate.
Add noodles to same pot and cook according to packet directions",Miso-Squash Ramen
11,"Drain and divide noodles among bowls.
Ladle broth over noodles and arrange broccolini and reserved squash (cut in half if they are very big) on top",Miso-Squash Ramen
12,Scatter cilantro over.,Miso-Squash Ramen
1,Heat the coconut oil in a large saucepan over medium heat,Spicy Coconut Pumpkin Soup
2,"Add the pumpkin, stir well, and cook, covered, for 15 minutes.
Add the onion, garlic, and ají dulce and stir well",Spicy Coconut Pumpkin Soup
3,"Sauté until the onion becomes translucent, 3 to 5 minutes, then add the brown sugar and cumin",Spicy Coconut Pumpkin Soup
4,Mix well,Spicy Coconut Pumpkin Soup
5,"Cook until the sugar melts, 2 to 3 minutes.
Stir in the coconut milk and broth",Spicy Coconut Pumpkin Soup
6,"Bring to a simmer and cook, uncovered, until the pumpkin is very soft, about 15 minutes.
Using an immersion blender, blend the soup into a smooth purée",Spicy Coconut Pumpkin Soup
7,"Alternatively, remove the solids with a slotted spoon and place in a blender or food processor",Spicy Coconut Pumpkin Soup
8,"Purée until smooth and return to the pan.
Bring back to a simmer and cook gently for 5 minutes so the flavors combine",Spicy Coconut Pumpkin Soup
9,Season with salt and black pepper to taste,Spicy Coconut Pumpkin Soup
10,"Serve hot, garnished with the cilantro.",Spicy Coconut Pumpkin Soup
1,"Prepare a hot grill or preheat the broiler.
With a fork, pierce the eggplants all over, and place on the grill or under the broiler",Baigan Chokha
2,"Grill or broil until completely charred and soft, about 20 minutes, turning frequently (the eggplants will brown and blister quickly)",Baigan Chokha
3,"Remove and allow to cool.
Once cool, cut open the eggplants and scrape out the flesh",Baigan Chokha
4,"The flesh should be soft to the touch and pulpy, and should easily come away from the skin",Baigan Chokha
5,"Set aside.
Heat the canola oil in a frying pan",Baigan Chokha
