step_number,description,Recipe_name
7,"Sprinkle the onions with one third of the Cheddar and continue to layer the remaining sauce, potatoes, onions, and Cheddar in the same manner",Old-Fashioned Scalloped Potatoes
8,"Sprinkle the top with bread crumbs, and dot it with the remaining 1 tablespoon butter, cut into bits.
Bake the mixture, covered with foil, in the middle of preheated oven for 20 minutes",Old-Fashioned Scalloped Potatoes
9,"Remove the foil and bake the potato mixture for 35 minutes more, or until the top is golden and the potatoes are tender.",Old-Fashioned Scalloped Potatoes
1,Preheat your oven to its highest setting (with fan if it has one),Yogurt and Spice Roasted Salmon
2,"Line a baking tray with baking paper.
Mix all the marinade ingredients together in a mixing bowl",Yogurt and Spice Roasted Salmon
3,"Add the salmon and turn until well coated in the marinade.
Spread the salmon out on the prepared baking tray and roast for 10 minutes until cooked through",Yogurt and Spice Roasted Salmon
4,"Remove from the oven and serve immediately with tortilla wraps, tomatoes, finely sliced onion, coriander leaves and Greek yogurt.",Yogurt and Spice Roasted Salmon
1,"Combine the water and yeast in a large mixing bowl (if you have a stand mixer, use that bowl) and let sit for 5 minutes.
Reserve ½ cup (60 grams) bread flour and add the remaining 4 cups to the mixing bowl along with the canola oil.
If you have a stand mixer, fit it with the dough hook and knead the mixture on low speed for about 3 minutes, until a sticky but cohesive dough starts to form",Pita
2,Pause occasionally to scrape down the bowl if the flour is clinging to the sides and bottom or climbing up the hook,Pita
3,"If you’re making the dough without a stand mixer, mix it with a wooden spoon",Pita
4,"In either case, loosely cover the bowl with plastic wrap or a dish towel and let rest for 30 minutes.
With your stand mixer on low or while stirring by hand in the mixing bowl, add the salt and, over the course of 2 or 3 minutes, add the remaining ½ cup flour, 2 tablespoons at a time",Pita
5,"The dough should be more tense; it will feel soft but tacky, although it will pull from the sides of the bowl.
Flour your hands generously and use them to pull the dough onto a clean, unfloured work surface",Pita
6,"Cup your hands around the dough, rolling it in short, circular strokes and using the sides of your hands to nudge it into a relatively smooth ball.
Lightly wipe the inside of a large bowl with canola oil and place the dough inside, flipping it once or twice to coat",Pita
7,"Loosely cover the bowl and let the dough rise at a warm room temperature for 1 hour.
After 1 hour, the dough will be stretchy but very soft",Pita
8,"Leaving it inside the bowl, stretch opposite sides of the dough over the center",Pita
9,"Rotate the bowl a quarter- turn and stretch the dough in the same way, then flip the whole mound of dough upside down and cover again",Pita
10,"Let rise for 1 hour.
Repeat this series of folds one more time, allow it to rise at room temperature for 1 hour, then tightly cover the bowl and refrigerate overnight or up to 2 days",Pita
11,"The longer the dough is refrigerated, the more flavor it will have",Pita
12,"After this rise, it’s ready to be shaped; bear in mind that, once it’s shaped, it will need more time for a final rise, so plan ahead.
Wipe a bit of canola oil on a large baking sheet",Pita
13,"Dump the dough onto a clean, dry counter, and use a bench scraper or sharp knife to cut it into eight equal pieces; make clean, decisive cuts rather than use a sawing motion, so you don’t deflate all the air inside.
Lightly flour your hands and place one palm directly over the dough ball, with all your fingertips touching the counter to make a sort of “cage” around the dough",Pita
14,"Roll it in brisk, small circles on the countertop so it tightens itself into a smoother, more taut ball.
Space the rounds of dough a few inches apart, seam side down, on the sheet, and roll to coat them lightly in oil",Pita
15,"Tightly cover the sheet with plastic wrap so the dough doesn’t dry out, and let them rise at room temperature for 2 to 4 more hours, until they’re pillowy.
Meanwhile, set a baking stone on the center rack of your oven and turn on the broiler",Pita
16,"You’re emulating a 700°F wood- burning oven, so you need to give the stone a good long while to preheat before you bake.
When the dough is ready, lightly flour a work surface, and use a bench scraper or thin metal spatula to coax one piece into your palm; be sure you don’t manhandle it or you’ll force out the pockets of air that formed while it rose",Pita
17,"Dust a little more flour on the top of the dough and onto your rolling pin.
With firm, even pressure, briskly roll the dough a few times along its length",Pita
18,"Flip it upside down, rotate it a quarter- turn, and roll it the same way, keeping it as round as possible",Pita
19,"Repeat, dusting a little extra flour as needed, until it’s about 6 inches across.
This next part happens fast and furiously, so make sure you have no distractions—screaming children and natural disasters will have to wait",Pita
20,Use tongs or a good oven mitt to pull the oven rack with the baking stone partially out,Pita
21,"Carefully pick up the pita, drape it over your palm, and slap it down onto the stone as if you’re giving it a high- five (just be careful not to touch the hot stone!)",Pita
22,"Set a timer for 1 minute, and close the oven",Pita
23,"Broilers vary in strength but all are quite hot, so don’t turn your back on the oven or the pita may burn",Pita
24,"Check on it— it should puff up and build in color, with some beautiful blistered spots",Pita
25,"If it’s still pale, close the oven and let it keep baking for 30- second intervals.
Use tongs to flip the pita, and let it finish baking with the oven door cracked so you can watch it finish",Pita
26,"Pull it out when the second side is as pretty as the first; this can take anywhere from 30 seconds to 2 minutes, depending on your broiler.
Bake off the rest of the dough this way; as you get the hang of it, feel free to bake two pitas at a time",Pita
27,Serve these hot or at room temperature.,Pita
1,"To make the “beet water,” roughly chop 2 pounds of the beets (select the smaller ones), preferably in a food processor fitted with the metal blade",Veselka's Famous Borscht
2,Place the chopped beets in a large stockpot,Veselka's Famous Borscht
3,"Add 10 cups of water and 1 tablespoon vinegar.
Place the stockpot over high heat and bring to a boil, then reduce the heat to low, and simmer for 2 hours",Veselka's Famous Borscht
4,"(If it seems like the liquid is evaporating too quickly, you may need to cover the pot partially with an offset lid.) The beets should be extremely soft and the liquid bright red.
Strain the liquid, pressing the cooked beets against the side of the strainer to extract as much liquid as possible",Veselka's Famous Borscht
5,Discard the pulp or reserve,Veselka's Famous Borscht
6,Set aside the beet water,Veselka's Famous Borscht
7,"You should have just about 4 cups.
Meanwhile, place the remaining 1 pound of whole beets in a separate large stockpot",Veselka's Famous Borscht
8,Add water to cover and bring to a boil,Veselka's Famous Borscht
9,"Reduce the heat to low, and simmer until the beets are tender-firm, about 40 minutes",Veselka's Famous Borscht
10,"When the beets are cooked, add 1 tablespoon white vinegar and set them aside to cool.
When the whole cooked beets are cool enough to handle, peel them; the skins should slip off easily",Veselka's Famous Borscht
11,"Grate the peeled beets on the largest holes of a box grater or in a food processor fitted with the grating blade.
To make the broth, place the pork butt in a large stockpot and add the beef stock",Veselka's Famous Borscht
12,"If necessary, add a little more stock or water to cover",Veselka's Famous Borscht
13,"Add the bay leaf, allspice berries, and peppercorns",Veselka's Famous Borscht
14,"Bring to a boil, reduce the heat to low, and simmer until the meat is tender and beginning to fall apart, about 2 hours",Veselka's Famous Borscht
15,Set the pork aside to cool,Veselka's Famous Borscht
16,"When the pork is cool enough to handle, remove it from the pot and cut the meat into ½-inch cubes",Veselka's Famous Borscht
17,"Strain the broth and discard the bay leaf, allspice berries, and peppercorns",Veselka's Famous Borscht
18,"Reserve the cubed meat and 4 cups of the broth.
To cook the vegetables, place the carrots and celery in a large stockpot and pour the reserved meat broth over them",Veselka's Famous Borscht
19,"Bring to a boil, reduce the heat, and simmer until the carrots and celery are just tender, about 8 minutes",Veselka's Famous Borscht
20,"Add the cabbage and potatoes and continue to cook until the potatoes and carrots are easily pierced with a pairing knife but keep their shape, 15 to 20 additional minutes",Veselka's Famous Borscht
21,"Add the lima beans and cook for 5 additional minutes, just to meld the flavors",Veselka's Famous Borscht
22,"Gradually add the remaining 7 tablespoons white vinegar, tasting between additions and stopping when the flavor is to your liking",Veselka's Famous Borscht
23,"Remove the soup from the heat and set aside.
To compose the soup, in a large soup pot combine the “beet water” and meat broth with the vegetables",Veselka's Famous Borscht
24,Add the cubed pork and the grated beets,Veselka's Famous Borscht
25,Stir to combine and bring to a simmer over low heat,Veselka's Famous Borscht
26,Season to taste with salt and serve immediately.,Veselka's Famous Borscht
1,"Using a sharp chef’s knife, score skin of each fish fillet in a crosshatch pattern, making cuts about ½"" apart",Papaya-and-Cubeb-Marinated Snapper With Baked Yam Chips
2,"Season fillets on both sides with salt and alligator pepper.
Toast cubeb peppers in a dry small skillet over medium-low heat, shaking occasionally, until fragrant, about 3 minutes",Papaya-and-Cubeb-Marinated Snapper With Baked Yam Chips
3,Transfer to a spice mill or mortar and pestle,Papaya-and-Cubeb-Marinated Snapper With Baked Yam Chips
4,Let cool and coarsely grind; set aside,Papaya-and-Cubeb-Marinated Snapper With Baked Yam Chips
5,"Coarsely chop half of papaya into 1"" pieces; set remaining half aside",Papaya-and-Cubeb-Marinated Snapper With Baked Yam Chips
6,"Coarsely chop half of cilantro (leaves and stems); set remaining cilantro aside.
Transfer chopped papaya to a blender; add oil and blend, adding 1–2 Tbsp",Papaya-and-Cubeb-Marinated Snapper With Baked Yam Chips
7,"water to get it going if needed, until smooth",Papaya-and-Cubeb-Marinated Snapper With Baked Yam Chips
8,"Add chopped cilantro, onion, garlic, ginger, ground chile, ¼ tsp",Papaya-and-Cubeb-Marinated Snapper With Baked Yam Chips
9,"salt, and reserved ground cubeb pepper",Papaya-and-Cubeb-Marinated Snapper With Baked Yam Chips
10,"Blend mixture to a smooth paste.
Coat fillets all over with marinade, rubbing into score marks",Papaya-and-Cubeb-Marinated Snapper With Baked Yam Chips
11,"Place fish, skin side down, in a single layer in a large baking dish",Papaya-and-Cubeb-Marinated Snapper With Baked Yam Chips
12,Squeeze juice from half a lemon over,Papaya-and-Cubeb-Marinated Snapper With Baked Yam Chips
13,Set remaining lemon half aside for serving,Papaya-and-Cubeb-Marinated Snapper With Baked Yam Chips
14,"Cover with plastic wrap or a lid and chill at least 2 hours and up to 12 hours.
Fill a large bowl with water",Papaya-and-Cubeb-Marinated Snapper With Baked Yam Chips
15,"Peel yams and slice in half lengthwise, then slice in half crosswise",Papaya-and-Cubeb-Marinated Snapper With Baked Yam Chips
16,"Cut each quarter into ½""-thick slabs",Papaya-and-Cubeb-Marinated Snapper With Baked Yam Chips
17,"(Length of slabs will depend on yam’s size, but you’re going for something that looks like steak fries.) Add yam slices to bowl as you work to prevent oxidation",Papaya-and-Cubeb-Marinated Snapper With Baked Yam Chips
18,"When all yams are cut, swish in water to remove excess starch, then drain",Papaya-and-Cubeb-Marinated Snapper With Baked Yam Chips
19,"Refill bowl and repeat process until water is clear, about 2 more times",Papaya-and-Cubeb-Marinated Snapper With Baked Yam Chips
20,Add sugar and ½ tsp,Papaya-and-Cubeb-Marinated Snapper With Baked Yam Chips
21,salt and stir until dissolved; add the drained chips,Papaya-and-Cubeb-Marinated Snapper With Baked Yam Chips
22,"(Yams, like many foods that are good for you, can be quite bitter; the sugar will help counter this.) Let soak 30 minutes.
Place a rack in middle of oven; preheat to 450°",Papaya-and-Cubeb-Marinated Snapper With Baked Yam Chips
23,Drain chips and pat dry with a clean kitchen towel,Papaya-and-Cubeb-Marinated Snapper With Baked Yam Chips
24,Transfer to a rimmed baking sheet and drizzle with 2 Tbsp,Papaya-and-Cubeb-Marinated Snapper With Baked Yam Chips
25,oil,Papaya-and-Cubeb-Marinated Snapper With Baked Yam Chips
26,"Season with black pepper, then sprinkle with chili powder and remaining 1 tsp",Papaya-and-Cubeb-Marinated Snapper With Baked Yam Chips
27,salt,Papaya-and-Cubeb-Marinated Snapper With Baked Yam Chips
28,"Toss to coat, then spread out into an even layer",Papaya-and-Cubeb-Marinated Snapper With Baked Yam Chips
29,"Roast chips, turning halfway through, until golden brown and crisp, about 20 minutes.
Heat broiler",Papaya-and-Cubeb-Marinated Snapper With Baked Yam Chips
30,"Scrape off excess marinade from fish and place fillets, skin side up, on another rimmed baking sheet",Papaya-and-Cubeb-Marinated Snapper With Baked Yam Chips
31,"Broil until browned and crisp on top and cooked through, 5–7 minutes.
Using a vegetable peeler, shave reserved papaya into ribbons, pick leaves from reserved cilantro stems, and cut reserved lemon half into wedges.
Transfer fish to plates and top with papaya and cilantro",Papaya-and-Cubeb-Marinated Snapper With Baked Yam Chips
32,Mound yam chips next to fillets,Papaya-and-Cubeb-Marinated Snapper With Baked Yam Chips
33,Serve with shito and lemon wedges alongside.,Papaya-and-Cubeb-Marinated Snapper With Baked Yam Chips
1,Place apricots in a small bowl and pour in hot water to cover,Drunk Apricot Shito (Ghanaian Hot Pepper Sauce)
2,"Let sit 20 minutes, then drain and coarsely chop",Drunk Apricot Shito (Ghanaian Hot Pepper Sauce)
3,Return apricots to same bowl and add rum; stir to coat,Drunk Apricot Shito (Ghanaian Hot Pepper Sauce)
4,Chill at least 30 minutes and up to 1 day,Drunk Apricot Shito (Ghanaian Hot Pepper Sauce)
5,Drain into a mesh sieve set over another small bowl or container,Drunk Apricot Shito (Ghanaian Hot Pepper Sauce)
6,"Reserve apricots and rum separately.
Melt butter in a medium saucepan over medium heat",Drunk Apricot Shito (Ghanaian Hot Pepper Sauce)
7,"Add cinnamon, 3 Tbsp",Drunk Apricot Shito (Ghanaian Hot Pepper Sauce)
8,"coconut sugar, and reserved apricots",Drunk Apricot Shito (Ghanaian Hot Pepper Sauce)
9,"Cook, stirring occasionally, until apricots are slightly softened and coated in caramel, 6–8 minutes",Drunk Apricot Shito (Ghanaian Hot Pepper Sauce)
10,"Add reserved rum and cook, stirring often, until thickened and syrupy, about 5 minutes",Drunk Apricot Shito (Ghanaian Hot Pepper Sauce)
11,Let cool slightly,Drunk Apricot Shito (Ghanaian Hot Pepper Sauce)
12,"(Just FYI: You can eat these drunk apricots right away over vanilla ice cream and be very happy.)
Toast grains of selim pods and cubeb peppers in a small skillet over medium-low heat, shaking occasionally, until fragrant, about 3 minutes",Drunk Apricot Shito (Ghanaian Hot Pepper Sauce)
13,Transfer to a spice mill or mortar and pestle and let cool,Drunk Apricot Shito (Ghanaian Hot Pepper Sauce)
14,Grind as well as you can,Drunk Apricot Shito (Ghanaian Hot Pepper Sauce)
15,"The grains of selim won’t completely break up, so cracked open but mostly whole is okay—you just want to release some of their flavor.
Heat oil in a large Dutch oven or other heavy pot over medium",Drunk Apricot Shito (Ghanaian Hot Pepper Sauce)
16,"Cook white and red onions, stirring occasionally, until softened and just starting brown, 20–25 minutes",Drunk Apricot Shito (Ghanaian Hot Pepper Sauce)
17,"Stir in ground grains of selim and cubeb pepper, garlic, ginger, and remaining 1 tsp",Drunk Apricot Shito (Ghanaian Hot Pepper Sauce)
18,coconut sugar,Drunk Apricot Shito (Ghanaian Hot Pepper Sauce)
19,"Cook, stirring occasionally, 5 minutes",Drunk Apricot Shito (Ghanaian Hot Pepper Sauce)
20,"Add red pepper flakes, rosemary, thyme, prawn powder, and 1 tsp",Drunk Apricot Shito (Ghanaian Hot Pepper Sauce)
21,"salt to pot and cook, stirring occasionally, about 2 minutes",Drunk Apricot Shito (Ghanaian Hot Pepper Sauce)
22,"Add drunk apricots along with any syrup and cook, stirring often, about 2 minutes.
Add tomato purée to pot and cook, stirring occasionally, 4 minutes, then stir in chile powder",Drunk Apricot Shito (Ghanaian Hot Pepper Sauce)
23,Add broth and fresh chile,Drunk Apricot Shito (Ghanaian Hot Pepper Sauce)
24,"Cover pot and cook, stirring occasionally to prevent sticking, until a loose dark brown paste forms, 30–40 minutes",Drunk Apricot Shito (Ghanaian Hot Pepper Sauce)
25,The oil will rise to the surface when the sauce is ready,Drunk Apricot Shito (Ghanaian Hot Pepper Sauce)
26,Remove from heat; taste and season with more salt if needed,Drunk Apricot Shito (Ghanaian Hot Pepper Sauce)
27,"If you like texture, leave as is, or blend with an immersion blender (or let it cool slightly and blend it in a blender) to make it smooth",Drunk Apricot Shito (Ghanaian Hot Pepper Sauce)
28,"Let cool completely.
Spoon shito into jars or an airtight container with at least a ¼"" layer of oil on top.
Do ahead: Shito can made 1 week ahead",Drunk Apricot Shito (Ghanaian Hot Pepper Sauce)
29,"Cover and chill.
Note: The amount of chile described in this recipe is what I would classify as pretty hot—some West Africans might call this medium hot, some very hot",Drunk Apricot Shito (Ghanaian Hot Pepper Sauce)
30,"Folks familiar with heat will enjoy this, but if you don’t like super-jacked heat you should probably err on the lower end of the range",Drunk Apricot Shito (Ghanaian Hot Pepper Sauce)
31,West African pantry staples can be found at Zoe's Ghana Kitchen.,Drunk Apricot Shito (Ghanaian Hot Pepper Sauce)
1,"Combine the dried beans and kombu in a large container and cover with plenty of water to soak for at least 4 hours or overnight; skip this step if using fresh beans.
Drain the beans and kombu and add them to a large pot with enough water to cover by about 1 in",Summer Bean Soup With Tomato Brown Butter
2,"(if using fresh beans, add the kombu now)",Summer Bean Soup With Tomato Brown Butter
3,"Bring to a boil over medium-high heat; meanwhile, halve the tomatoes and cut the celery, carrot, and leek into about 3 in",Summer Bean Soup With Tomato Brown Butter
4,pieces,Summer Bean Soup With Tomato Brown Butter
5,"As soon as the water boils, decrease the heat to medium-low and add the vegetables to the pot, along with the whole shallots and minced garlic",Summer Bean Soup With Tomato Brown Butter
6,"Continue to cook at a gentle simmer until the beans are very creamy, 60 to 90 minutes for dried beans and about half that for fresh.
Remove the pot from the heat and use a slotted spoon to reserve the tomatoes; remove and discard the other vegetables.
Set up a sieve over a heat proof container and strain the beans (there should be about 3 cups or 480 g), reserving all the cooking liquid.
In a blender, combine 1 cup (160 g) of the cooked beans with 2 cups (480 ml) of the cooking liquid, plus the tomatoes, anchovies, oil, maple syrup, salt, red pepper flakes, and mustard",Summer Bean Soup With Tomato Brown Butter
7,"Purée until extremely smooth, pour into a large bowl, and fold in the reserved cooked beans by hand",Summer Bean Soup With Tomato Brown Butter
8,"At this point, you can serve it right away or transfer to an airtight container and refrigerate for up to 3 days, gently rewarming over medium-low heat when you’re ready to serve.
While the bean soup is cooking, preheat the oven to 325°F",Summer Bean Soup With Tomato Brown Butter
9,Cut the bacon into ¼ in,Summer Bean Soup With Tomato Brown Butter
10,lardons; reserve 3 whole beans for garnish and cut the rest into 2 to 3 in,Summer Bean Soup With Tomato Brown Butter
11,"pieces.
In a medium saucepan or Dutch oven, spread the bacon in an even layer and cook over medium-low heat until it starts to turn golden and crisp, about 10 minutes",Summer Bean Soup With Tomato Brown Butter
12,"Use a slotted spoon to remove the pieces but leave the fat behind.
Increase the heat slightly, and sauté the shallots until translucent, 5 to 10 minutes",Summer Bean Soup With Tomato Brown Butter
13,"Stir in the chopped beans, bacon, and red pepper flakes",Summer Bean Soup With Tomato Brown Butter
14,"Cover with a lid or a tight layer of foil and bake until the beans are very soft, 60 to 90 minutes",Summer Bean Soup With Tomato Brown Butter
15,"Stir in the lemon zest, juice, and garlic as soon as the beans come out of the oven and cover again; the residual steam will cook the garlic.
Thinly slice the pickled green beans on the bias",Summer Bean Soup With Tomato Brown Butter
16,"Combine with the cherry tomatoes, oil, and vinegar.
To serve, ladle the bean soup into bowls with a big spoonful of the baked beans on top",Summer Bean Soup With Tomato Brown Butter
17,"Garnish with the pickled green bean mix, a swirl of tomato brown butter, crumbled feta, and torn fresh herbs",Summer Bean Soup With Tomato Brown Butter
18,"Leftovers can all be refrigerated in separate airtight containers, though the green bean salad is best on the day it’s made, when the beans are most crisp and the tomatoes are fresh.
This works for any amount of dense vegetables or dense, underripe fruit, either whole or cut up, such as carrots, turnips, beets, winter squash, onions, green beans, Brussels sprouts, green tomatoes, small apples, underripe peaches, and whole baby cabbages",Summer Bean Soup With Tomato Brown Butter
19,"Peel off any tough skins, such as on beets, winter squash, and onions, and trim the tops",Summer Bean Soup With Tomato Brown Butter
20,Leave the vegetables whole or cut them into the desired finished shape,Summer Bean Soup With Tomato Brown Butter
21,"Place the vegetables in a nonreactive container and pour water to completely submerge them; as you do so, keep track of how much water you’re adding since the amount of water will dictate the amount of salt (generally 3.5 percent salt by weight of the water for most vegetables, although cucumbers can handle 4 to 5 percent and the increased salt assists with keeping their texture crispy)",Summer Bean Soup With Tomato Brown Butter
22,"With a long wooden spoon, stir kosher salt into the brine (or add the salt, cap the jar, and give it a hearty shake) until the salt is dissolved",Summer Bean Soup With Tomato Brown Butter
23,Place a weight on top of the vegetables to keep them submerged in the brine,Summer Bean Soup With Tomato Brown Butter
24,"Seal the container, using a lid with an airlock if you have one",Summer Bean Soup With Tomato Brown Butter
25,"If you don’t have an airlock, you’ll just need to open the container every few days or so to release carbon dioxide buildup and check for mold",Summer Bean Soup With Tomato Brown Butter
26,"Place the container in a clean, low-light area with an ambient temperature of 60°F to 68°F until the pickles taste sour, about 3 weeks",Summer Bean Soup With Tomato Brown Butter
27,Refrigerate indefinitely.,Summer Bean Soup With Tomato Brown Butter
1,"Place the tomato in a blender and purée, then strain through a fine-mesh sieve; you should get about ½ cup (120 ml)",Tomato Brown Butter
2,Add the butter to a large skillet and gently cook over medium heat until it starts to brown and smell nutty,Tomato Brown Butter
3,Stir in the smooth tomato purée (be careful; it might spatter) and simmer for another minute or so,Tomato Brown Butter
4,You’re looking to slightly cook the purée but keep its brightness,Tomato Brown Butter
5,"The mix won’t emulsify, which is fine",Tomato Brown Butter
6,Season with salt and pepper and set aside.,Tomato Brown Butter
1,"Preheat the oven to 350°F.
Place the squash, cut sides up, on a sheet pan",Maple-Roasted Acorn Squash
2,Place ½ tablespoon butter and ½ tablespoon maple syrup in the cavity of each squash,Maple-Roasted Acorn Squash
3,Brush the cut sides with olive oil and sprinkle the squash with 3 teaspoons kosher salt and 1 teaspoon pepper,Maple-Roasted Acorn Squash
4,"Roast for 40 to 60 minutes, depending on the size of the squash, until tender when pierced with a small knife.
Place the squash on a serving platter",Maple-Roasted Acorn Squash
5,"If the halves are too large for one serving, cut each piece in half through the stem",Maple-Roasted Acorn Squash
6,"Drizzle lightly with extra maple syrup, sprinkle with sea salt, and serve hot.
Acorn squash is hard to cut",Maple-Roasted Acorn Squash
7,"To halve a whole squash, plunge the blade of a large chef’s knife into the side of the squash as far as it will go",Maple-Roasted Acorn Squash
8,"Holding the handle of the knife, bang the squash (with the knife in it) on the board until the blade cuts all the way through.",Maple-Roasted Acorn Squash
1,Heat oil in a large nonstick skillet over medium,Coconut-Creamed Corn and Grains
2,"Cook chile, ginger, garlic, and 2 sliced scallions, tossing, until softened and fragrant, about 3 minutes",Coconut-Creamed Corn and Grains
