step_number,description,Recipe_name
6,Add the onion and sauté until translucent,Baigan Chokha
7,"Add the garlic and fry until the garlic turns a dark golden brown, then add the tomato and fry for 1 to 2 minutes.
Stir in the mashed eggplant and cook for about 2 minutes",Baigan Chokha
8,Season with salt and black pepper to taste,Baigan Chokha
9,Garnish with the cilantro and serve with roti.,Baigan Chokha
1,Place the chicken pieces in a bowl and toss with the lime juice,Dad’s Curried Chicken
2,"Drain, rinse the chicken with cold water, and drain again",Dad’s Curried Chicken
3,"Remove the chicken from the bowl and pat dry with paper towels.
Place the chicken in another bowl with the Green Seasoning, salt, chili pepper, and garlic",Dad’s Curried Chicken
4,"Toss well to coat and refrigerate for at least 30 minutes but ideally overnight.
Combine the curry powder with just enough water to form a thick paste",Dad’s Curried Chicken
5,Heat the oil in a heavy-bottomed pot,Dad’s Curried Chicken
6,Add the curry paste and onion,Dad’s Curried Chicken
7,"Cook, stirring constantly, for 1 to 2 minutes over medium-low heat—do not allow the curry to scorch",Dad’s Curried Chicken
8,Add the chicken pieces and stir well to coat,Dad’s Curried Chicken
9,"Add the stock or water, cover, and simmer for 30 to 40 minutes, or until the chicken is tender.
Remove the lid and simmer for 5 minutes more over medium-high heat, until the sauce reduces by one-third",Dad’s Curried Chicken
10,Serve with roti or white rice.,Dad’s Curried Chicken
1,"Break open the cardamom pods, remove the seeds, and discard the pods.
Place the cardamom seeds, coriander, seeds, cumin seeds, mustard seeds, fenugreek seeds, and curry leaves in a heavy frying pan and toast, swirling for about 5 minutes, until the spices begin to release their aromas.
Place the toasted spices in a food processor or spice grinder and add the peppercorns and cloves",Trinidad Curry Powder
2,Grind the mixture to a find powder,Trinidad Curry Powder
3,"Stir in the turmeric.
Store in an airtight container",Trinidad Curry Powder
4,"If stored properly, curry powder will keep for at least two months.",Trinidad Curry Powder
1,"In a large heavy kettle cook garlic, onions, celery, and bell peppers in oil over moderately low heat, stirring occasionally, until softened",Shrimp Creole
2,"Add all remaining ingredients except shrimp and simmer, uncovered, 30 minutes, or until thickened",Shrimp Creole
3,"Stir in shrimp and cook, covered, over moderately high heat, stirring occasionally, until shrimp are cooked through, about 5 minutes.
Serve shrimp and sauce over coked rice.",Shrimp Creole
1,Process all the ingredients in a food processor until the mixture forms a thick paste,Green Seasoning
2,"(Alternatively, process in a blender with 2 Tbsp",Green Seasoning
3,"vinegar.)
Use immediately, or store in a tightly sealed glass jar in the refrigerator for up to 1 week.",Green Seasoning
1,"If using dried peas, soak them overnight in 3 cups of water",Chicken Pelau
2,Drain,Chicken Pelau
3,Bring 3 fresh cups of water to a boil in a saucepan and add the peas,Chicken Pelau
4,"Simmer for 15 minutes, or until cooked almost completely through",Chicken Pelau
5,Drain and set aside,Chicken Pelau
6,"If using canned beans, drain, rinse with cold water, drain again, and set aside",Chicken Pelau
7,"Wash the rice by placing it in a colander or fine-mesh sieve and running cold water over it until the water runs clear, about 1 minute",Chicken Pelau
8,"Drain well and set aside.
Heat the oil over medium heat in a Dutch oven or other heavy, deep pot",Chicken Pelau
9,"Add the sugar and swirl in the pot, stirring constantly; allow it to caramelize to a dark brown color",Chicken Pelau
10,Add the chicken and stir well to coat,Chicken Pelau
11,"Add the onion and garlic and cook for 1 to 2 minutes, stirring constantly.
Stir in 2 cups of water, the coconut milk, bay leaf, Green Seasoning, parsley, thyme, carrots, and scallions",Chicken Pelau
12,Season with salt,Chicken Pelau
13,"Reduce the heat to medium-low, cover, and simmer for 10 minutes.
Stir the rice, squash, peas, hot pepper, ketchup, and butter into the chicken",Chicken Pelau
14,"Cover and cook for 20 minutes, or until the peas and vegetables are tender",Chicken Pelau
15,Remove lid and fluff the rice,Chicken Pelau
16,The rice should be moist but not sticky,Chicken Pelau
17,"Remove bay leaf, thyme sprig, and hot pepper.
Note: Pigeon peas are traditional in this dish, but pinto beans or black-eyes peas also work well because, like pigeon peas, they hold their shape well after cooking",Chicken Pelau
18,Brown sugar is preferable for deeper flavor and color,Chicken Pelau
19,"Chicken is the most common meat in pelau, but cuts of stew beef or lamb work just as well",Chicken Pelau
20,"If using meat, up the cooking time before adding the rice to 40 minutes to allow the meat to get tender",Chicken Pelau
21,"In Tobago, pelau is often made with crab",Chicken Pelau
22,"West Indian pumpkin (also called calabaza) is ideal for this recipe, although the pie or ""cheese"" pumpkin common in the U.S., if in season, makes a very good substitute",Chicken Pelau
23,"Butternut squash will also work, although it will be slightly less sweet.",Chicken Pelau
1,"Cover potatoes, garlic, and 1 Tbsp",Our Favorite Creamy Mashed Potatoes
2,salt with cold water in a large pot,Our Favorite Creamy Mashed Potatoes
3,"Bring to a low boil, then reduce heat and simmer (do not boil) until potatoes are very tender when pierced with the tip of a paring knife but not falling apart, 20–25 minutes.
Meanwhile, heat milk, thyme, and 3/4 cup butter in a small pot over medium, stirring, until butter is melted",Our Favorite Creamy Mashed Potatoes
4,"Remove from heat; set aside.
Drain potatoes and garlic; return to pot",Our Favorite Creamy Mashed Potatoes
5,"Toss over low heat until moisture evaporates, 1–2 minutes",Our Favorite Creamy Mashed Potatoes
6,"Using potato ricer or food mill, immediately press potatoes and garlic into a large bowl (do not let cool).
Discard thyme from milk mixture and gradually stir into potatoes, reserving about 1/2 cup if you plan to make in advance (see Do Ahead)",Our Favorite Creamy Mashed Potatoes
7,Season with 2 tsp,Our Favorite Creamy Mashed Potatoes
8,salt and 3/4 tsp,Our Favorite Creamy Mashed Potatoes
9,pepper,Our Favorite Creamy Mashed Potatoes
10,Fold in sour cream and stir with a spoon until incorporated and very smooth (do not overmix or potatoes will become gummy),Our Favorite Creamy Mashed Potatoes
11,Taste and adjust seasonings,Our Favorite Creamy Mashed Potatoes
12,Serve topped with remaining 2 Tbsp,Our Favorite Creamy Mashed Potatoes
13,"butter and more pepper.
Mashed potatoes can be made 2 hours ahead; cover and store at room temperature",Our Favorite Creamy Mashed Potatoes
14,"Or chill, covered, up to 8 hours; reheat over medium with reserved 1/2 cup milk mixture.",Our Favorite Creamy Mashed Potatoes
1,Combine all the ingredients in a chilled rocks glass,Remember the Alimony
2,Add one large ice cube and stir for 10 seconds,Remember the Alimony
3,Garnish with an orange twist.,Remember the Alimony
1,Make the crust,Creole Cream Cheesecake With Caramel-Apple Topping
2,Preheat the oven to 375°F,Creole Cream Cheesecake With Caramel-Apple Topping
3,"In a medium bowl, stir together the graham cracker crumbs, granulated sugar, brown sugar, salt, and butter to combine",Creole Cream Cheesecake With Caramel-Apple Topping
4,"Pat the mixture into a 10-inch springform pan, pressing the crumbs firmly in an even layer on the bottom and making sure they come at least halfway up the side of the pan",Creole Cream Cheesecake With Caramel-Apple Topping
5,"Bake for 7 to 10 minutes, until the crust is fragrant, dry, and toasty",Creole Cream Cheesecake With Caramel-Apple Topping
6,"Let cool, then wrap the entire outside of the pan tightly in two layers of foil, all the way to the top.
In the bowl of a stand mixer fitted with the paddle attachment or in a large bowl using a handheld mixer, cream the plain cream cheese and sugar on medium-high speed for about 4 minutes, until incredibly smooth and light",Creole Cream Cheesecake With Caramel-Apple Topping
7,Stop the mixer and scrape down the bottom and sides of the bowl with a rubber spatula,Creole Cream Cheesecake With Caramel-Apple Topping
8,"Add the Creole Cream Cheese and vanilla paste and beat on medium-high speed for about 2 minutes, scraping down the bowl once more",Creole Cream Cheesecake With Caramel-Apple Topping
9,"Decrease the speed to medium and beat in the eggs, one at a time, incorporating each one before adding the next",Creole Cream Cheesecake With Caramel-Apple Topping
10,Mix just until the batter is smooth and uniform,Creole Cream Cheesecake With Caramel-Apple Topping
11,"Continuing to mix past that point, even though the batter won’t look different, only incorporates extra air, which will cause the cheesecake to bubble excessively and the surface to crack as that air tries to escape during the baking process.
Decrease the oven temperature to 350°F",Creole Cream Cheesecake With Caramel-Apple Topping
12,Pour the batter into the prepared crust and tap the pan gently on the counter a few times to remove any large air bubbles,Creole Cream Cheesecake With Caramel-Apple Topping
13,Place the springform pan in a large baking or roasting pan (just big enough for the springform pan to fit in) and set the pan on the middle rack in the oven,Creole Cream Cheesecake With Caramel-Apple Topping
14,Fill the pan with enough hot water to reach the rim of the springform pan,Creole Cream Cheesecake With Caramel-Apple Topping
15,"Bake for about 1 hour, or until the sides of the custard are set and the middle is still just slightly wobbly",Creole Cream Cheesecake With Caramel-Apple Topping
16,"Generally, if the entirety of the custard is fully set, your cheesecake is overbaked",Creole Cream Cheesecake With Caramel-Apple Topping
17,"Don’t panic—it’ll still be delicious, and you’ll do better next time!
Let the cheesecake cool in the water until it is about room temperature",Creole Cream Cheesecake With Caramel-Apple Topping
18,"(You don’t want to have to try to grab the pan out of hot water if you can help it.) However, if you’re worried that your cheesecake might be slightly overbaked, you’ll want to pull it out rather quickly, and let it cool at room temperature",Creole Cream Cheesecake With Caramel-Apple Topping
19,Refrigerate for at least 3 hours before slicing,Creole Cream Cheesecake With Caramel-Apple Topping
20,"The cake can be refrigerated, covered, for up to 4 days.
In a large heavy-bottomed sauté pan, heat the butter until melted",Creole Cream Cheesecake With Caramel-Apple Topping
21,"Stir in the granulated sugar, brown sugar, and honey and let cook until bubbling",Creole Cream Cheesecake With Caramel-Apple Topping
22,Add the apples and toss to coat,Creole Cream Cheesecake With Caramel-Apple Topping
23,"Stir in the lemon zest, lemon juice, salt, cinnamon, cardamom, and ginger; stir to combine",Creole Cream Cheesecake With Caramel-Apple Topping
24,"Cook for about 4 minutes, or until the apples just start to soften",Creole Cream Cheesecake With Caramel-Apple Topping
25,"Remove from the heat, stir in the vanilla, and transfer to a bowl to cool completely before use",Creole Cream Cheesecake With Caramel-Apple Topping
26,The filling can be made up to 3 days ahead of time and stored in an airtight container in the refrigerator.,Creole Cream Cheesecake With Caramel-Apple Topping
1,"In a large heavy-bottomed saucepot over medium heat with a kitchen thermometer attached to the rim, warm the milk and buttermilk to 85°F",Creole Cream Cheese
2,Add one-quarter of the rennet tablet and transfer the mixture to a plastic container or bowl,Creole Cream Cheese
3,Cover with plastic wrap and then poke a few holes in the plastic to allow the steam to escape,Creole Cream Cheese
4,"Let stand at room temperature in a cool spot in your house for 48 hours.
Use a slotted spoon to transfer the solids to a double layer of cheesecloth set over a bowl and discard the liquid",Creole Cream Cheese
5,"Wrap the solids in the cheesecloth and hang it over the bowl (to catch the whey) in the refrigerator for 24 hours.
Discard the whey",Creole Cream Cheese
6,Pack the cheese into an airtight plastic container and store in the refrigerator for up to 1 week.,Creole Cream Cheese
1,"Whisk milk powder, baking powder, granulated sugar, and 2 cups (240 g) flour in a large shallow bowl",Buss Up Shut (Paratha Roti)
2,Add about a fourth of ¾ cup warm water (110°) and mix in a wide circular motion with your fingers to gently combine (do not knead),Buss Up Shut (Paratha Roti)
3,"As mixture becomes dry, add more of the water, little by little, and keep mixing gently until a shaggy dough forms; it should be soft and sticky, without dry spots",Buss Up Shut (Paratha Roti)
4,"(Depending on the humidity, you may not need all of the water.)
Drizzle 1 Tbsp",Buss Up Shut (Paratha Roti)
5,oil over dough and gently press with your knuckles so that the top of dough is covered with oil,Buss Up Shut (Paratha Roti)
6,"Cover bowl with a damp kitchen towel or plastic wrap and let rest in a warm spot 15 minutes.
Meanwhile, mix shortening and ghee in a small bowl until smooth.
Turn out dough onto a lightly floured surface",Buss Up Shut (Paratha Roti)
7,"Flour your hands and gently fold dough over on itself once or twice, then roll into a fat cylinder",Buss Up Shut (Paratha Roti)
8,"Working quickly, without handling the dough too much, divide dough into four equal pieces and gently form each piece into a ball",Buss Up Shut (Paratha Roti)
9,"Cover balls with a damp kitchen towel or plastic wrap and let rest 10 minutes.
Roll out a dough ball on a lightly floured surface into a 5-6""–diameter round",Buss Up Shut (Paratha Roti)
10,Brush with a quarter of shortening mixture and sprinkle evenly with flour,Buss Up Shut (Paratha Roti)
11,"Cut a slit halfway across the dough, from the center to the edge",Buss Up Shut (Paratha Roti)
12,"Starting on one side of slit, fold cut edge of dough at about a ¾"" interval",Buss Up Shut (Paratha Roti)
13,Continue folding process until you reach the other side of the slit and have formed a cone,Buss Up Shut (Paratha Roti)
14,"Pinch together edges at wide end of cone to seal, then bring both point ends together at the top and gently push in toward center of cone to create a dimple (you don’t need to push in too far)",Buss Up Shut (Paratha Roti)
15,Push point at narrow end of cone in toward the center,Buss Up Shut (Paratha Roti)
16,You should now have a ball with a dimple on each end,Buss Up Shut (Paratha Roti)
17,Transfer to a lightly floured surface and repeat with remaining balls of dough,Buss Up Shut (Paratha Roti)
18,"Cover balls with a damp kitchen towel or plastic wrap and let rest 20 minutes.
Heat a tawa or griddle over medium until a drop of water immediately sizzles on surface, about 2 minutes.
Meanwhile, place a ball of dough on a dimpled side on a lightly floured surface",Buss Up Shut (Paratha Roti)
19,"Gently flatten into a round with your hands, turning once if desired, then roll, rotating often, to a ⅛""-thick round, about 10–12"".
Brush tawa with a thin layer of oil",Buss Up Shut (Paratha Roti)
20,"Cook roti until it begins to bubble slightly across the surface, about 20 seconds",Buss Up Shut (Paratha Roti)
21,"Brush surface of roti with oil and continue to cook until bubbles across surface increase and roti is stiff enough on bottom side to turn, about 1 minute more",Buss Up Shut (Paratha Roti)
22,Turn roti over and brush surface with oil (bubbles may deflate; that’s okay),Buss Up Shut (Paratha Roti)
23,"Using a spatula, move roti around to avoid hot spots and ensure even cooking, pressing on edges and uncooked spots to increase contact with pan",Buss Up Shut (Paratha Roti)
24,"Continue to cook, turning every 30 seconds or so, until cooked through and both sides are speckled with golden brown spots, 1–2 minutes more",Buss Up Shut (Paratha Roti)
25,"Using 2 spatulas, push opposite edges of roti toward the center",Buss Up Shut (Paratha Roti)
26,"Smack down on the bunched roti with the ends of the spatulas to break up and flake, then turn roti over",Buss Up Shut (Paratha Roti)
27,"Repeat process, scrunching and smacking roti from different directions, until flaky and lightly shredded",Buss Up Shut (Paratha Roti)
28,Transfer to a clean kitchen towel set inside a bowl or basket and wrap up to keep warm,Buss Up Shut (Paratha Roti)
29,"Repeat with remaining dough balls and more oil, adding finished roti to bowl and covering tightly with towel as you go.",Buss Up Shut (Paratha Roti)
1,"Cover eggs with cold water by 1 1/2 inches in a 3-quart heavy saucepan and bring to a rolling boil, partially covered",Best Deviled Eggs
2,"Reduce heat to low and cook eggs, covered completely, 30 seconds",Best Deviled Eggs
3,"Remove from heat and let stand, covered, 15 minutes",Best Deviled Eggs
4,"Transfer eggs with a slotted spoon to a bowl of ice and cold water to stop cooking and let stand 5 minutes.
Peel eggs and halve lengthwise",Best Deviled Eggs
5,Carefully remove yolks and mash in a bowl with a fork,Best Deviled Eggs
6,"Add mayonnaise, mustard, and cayenne and stir with fork until smooth, then season with salt and pepper",Best Deviled Eggs
7,Fill pastry bag with yolk mixture and pipe into egg whites.,Best Deviled Eggs
1,"In a bowl, combine mangoes, shallots, green chiles, ginger, garlic, vinegar, and salt and mix well",Mango Curry
2,"Set aside for 2 hours.
In a large saucepan, combine mango mixture and coconut milk and bring to a boil",Mango Curry
3,"Reduce heat and simmer for 5 minutes, or until mangoes are softened.
Have a splash guard and measured spices nearby",Mango Curry
4,Heat oil in a small frying pan over medium-high heat until nearly smoking,Mango Curry
5,Immediately reduce heat to medium,Mango Curry
6,(You can test the heat of the oil by dropping in a couple of seeds,Mango Curry
7,"The oil is at the correct temperature when the seeds crackle, but do not burn.) Add mustard seeds and temper for a few seconds, until they stop popping",Mango Curry
8,"(Cover with the splash guard, if needed.) Add red chiles and curry leaves and cook for 15–20 seconds",Mango Curry
9,"Add the tempered spice mixture to the saucepan and stir to combine.
Garnish with fried onions (if using)",Mango Curry
10,"Serve with rice.
Tempering is a traditional method of extracting optimal flavor from Indian spices, and it is a skill learned with practice! Reducing the heat a little before adding the spices prevents the spices from burning and adding a bitterness to your dish",Mango Curry
11,"If they do burn, simply start again with fresh spices.",Mango Curry
1,"Bring piloncillo, canela, cardamom, allspice, peppercorns, salt, and 1 cup water to a boil in a small saucepan",Iced Café de Olla
2,"Reduce heat, cover, and simmer 15 minutes",Iced Café de Olla
3,"Add orange zest; let cool.
Strain spiced syrup through a fine-mesh sieve into a measuring glass; discard spices",Iced Café de Olla
4,"(You should have about 1 cup.)
To make 1 drink, pour 1 cup cold-brew coffee into an ice-filled glass",Iced Café de Olla
5,Stir in 2–3 Tbsp,Iced Café de Olla
6,spiced syrup; top with 2–3 Tbsp,Iced Café de Olla
7,"coconut milk.
Do Ahead: Syrup can be made 1 week ahead",Iced Café de Olla
8,Cover and chill.,Iced Café de Olla
1,"Place an 8-inch ovenproof skillet or cast-iron pan in the oven and preheat to 425°.
Once the oven reaches temperature, blend 3 large eggs in a blender until well combined and frothy, 1 minute",Pumpkin Dutch Baby With Pumpkin Butter
2,"Add ¼ cup of the pumpkin purée, then 1 cup milk, and then 1 Tbsp",Pumpkin Dutch Baby With Pumpkin Butter
3,"of the butter, blending for 30 seconds after each addition",Pumpkin Dutch Baby With Pumpkin Butter
4,"Add 1 cup all-purpose flour, ¼ tsp",Pumpkin Dutch Baby With Pumpkin Butter
5,"allspice, ¼ tsp",Pumpkin Dutch Baby With Pumpkin Butter
6,"ground ginger, ¼ tsp",Pumpkin Dutch Baby With Pumpkin Butter
7,"nutmeg, ½ tsp",Pumpkin Dutch Baby With Pumpkin Butter
8,"salt, and 1 tsp",Pumpkin Dutch Baby With Pumpkin Butter
9,of the cinnamon in one addition,Pumpkin Dutch Baby With Pumpkin Butter
10,"Blend again until combined and frothy, 1 minute (scraping down the sides of the blender if necessary).
Pull the hot pan from the oven and add the remaining 2 Tbsp",Pumpkin Dutch Baby With Pumpkin Butter
11,"butter, swirling the pan so it melts evenly across the bottom (it will bubble and brown)",Pumpkin Dutch Baby With Pumpkin Butter
12,"Once the butter is melted, immediately pour in the Dutch baby batter and return to the oven",Pumpkin Dutch Baby With Pumpkin Butter
13,"Bake until golden brown and slightly puffed, 20 minutes.
While the Dutch baby bakes, combine ½ cup apple cider, 3 Tbsp",Pumpkin Dutch Baby With Pumpkin Butter
14,"maple syrup, the remaining ½ tsp",Pumpkin Dutch Baby With Pumpkin Butter
15,"cinnamon, a pinch of salt, and the rest of the can of pumpkin purée (about 1 ¼ cups) in a small saucepan",Pumpkin Dutch Baby With Pumpkin Butter
16,"Cook over medium-high heat until the mixture starts to bubble, then reduce to medium and cook, stirring frequently and scraping down the sides of the pot with a spatula, until dark and thickened with no raw pumpkin flavor remaining, 20 to 25 minutes",Pumpkin Dutch Baby With Pumpkin Butter
17,Slice the Dutch baby (it will start to sink as soon as you take it out of the oven) and serve with the pumpkin butter and powdered sugar.,Pumpkin Dutch Baby With Pumpkin Butter
1,Place a rack in middle of oven; preheat to 375°F,Braised Chicken Legs With Grapes and Fennel
2,Season chicken legs all over with 3 tsp,Braised Chicken Legs With Grapes and Fennel
3,"salt.
Swirl 1 Tbsp",Braised Chicken Legs With Grapes and Fennel
4,oil in a large Dutch oven or other heavy pot to coat and heat over medium-high,Braised Chicken Legs With Grapes and Fennel
5,"Place 2 chicken legs, skin side down, in pot, making sure skin is in direct contact with pan",Braised Chicken Legs With Grapes and Fennel
6,"Cook, undisturbed, until dark golden, about 5 minutes",Braised Chicken Legs With Grapes and Fennel
7,"Turn over and cook until golden on other side, about 2 minutes",Braised Chicken Legs With Grapes and Fennel
8,Transfer to a large plate,Braised Chicken Legs With Grapes and Fennel
9,"Repeat with remaining 2 chicken legs; reserve pot.
Meanwhile, working one at a time, stand a bulb, root end down, on a cutting board and slice off a short end to create a flat surface",Braised Chicken Legs With Grapes and Fennel
10,"Turn cut side down and slice ½"" thick, starting from the top end of bulb so the root end can hold the layers in place while you slice",Braised Chicken Legs With Grapes and Fennel
11,"Discard last ¼"" (root end) of each bulb and pop out and discard tougher center from slices",Braised Chicken Legs With Grapes and Fennel
12,"Transfer fennel to a large bowl and add half of the grapes, ½ tsp",Braised Chicken Legs With Grapes and Fennel
13,"salt, and remaining 1 Tbsp",Braised Chicken Legs With Grapes and Fennel
14,oil; toss to coat,Braised Chicken Legs With Grapes and Fennel
15,"Set aside.
Reduce heat to medium and combine broth, honey, chile paste, and remaining 1 tsp",Braised Chicken Legs With Grapes and Fennel
16,salt in reserved pot,Braised Chicken Legs With Grapes and Fennel
17,Stir to combine and dissolve salt,Braised Chicken Legs With Grapes and Fennel
18,"Place remaining grapes in pot and arrange chicken legs, skin side up and overlapping if needed, over grapes",Braised Chicken Legs With Grapes and Fennel
19,Top with dressed fennel and grapes,Braised Chicken Legs With Grapes and Fennel
20,"(Don’t worry if it looks crowded: Fennel will soften as it cooks.)
Transfer pot, uncovered, to oven and roast until fennel is slightly softened, with some crispy, caramelized edges, grapes on top are swollen and browned in spots, and chicken is cooked through, 30–40 minutes",Braised Chicken Legs With Grapes and Fennel
21,"Let cool 5 minutes.
Using a slotted spoon or tongs, transfer grapes and fennel to a bowl and chicken to a platter",Braised Chicken Legs With Grapes and Fennel
22,Place pot over medium-high heat and bring braising liquid to a simmer,Braised Chicken Legs With Grapes and Fennel
23,"Cook until reduced by half (you should have about 1 cup liquid), 8–10 minutes",Braised Chicken Legs With Grapes and Fennel
24,"Remove from heat and stir in vinegar and fennel fronds.
Spoon sauce over chicken and serve with fennel and grapes alongside.",Braised Chicken Legs With Grapes and Fennel
1,Preheat oven to 400°,Old-Fashioned Scalloped Potatoes
2,"In a skillet, cook the onion and 2 tablespoons of the butter over moderately low heat, stirring, until it is very soft",Old-Fashioned Scalloped Potatoes
3,"In a heavy saucepan, melt 6 tablespoons of the remaining butter over moderately low heat, whisk in the flour, and cook the roux, whisking, for 3 minutes",Old-Fashioned Scalloped Potatoes
4,"Add the milk, scalded, in a stream, whisking, and bring the sauce to a boil",Old-Fashioned Scalloped Potatoes
5,"Simmer the sauce, whisking, for 1 minute and add salt and pepper to taste.
Peel the potatoes and slice them ⅛-inch thick",Old-Fashioned Scalloped Potatoes
6,"Spread about one third of the sauce in the bottom of a well-buttered 3-quart gratin dish at least 2 ½-inches deep, cover it with a layer of potato slices, overlapping the slices slightly, and cover the potatoes with one third of the onions",Old-Fashioned Scalloped Potatoes
